{
  "schemaVersion": 1,
  "paperId": "2606.21088",
  "reportStatus": "full-text-reviewed",
  "resourceType": "paper",
  "generatedAt": "2026-09-08T14:11:44.181Z",
  "sources": [
    {
      "id": "primary",
      "url": "https://arxiv.org/pdf/2606.21088",
      "title": "MV-WAM: Manifold-Aware World Action Model with Value Augmentation",
      "kind": "pdf",
      "sha256": "8360e2e4fabb4fed2c537f61da2d3ebb08759caed47869f63839f089bdc8b463",
      "wordCount": 10463,
      "accessedAt": "2026-09-07T13:58:46.565381+00:00"
    }
  ],
  "coverage": {
    "scope": "full-paper",
    "sectionsRead": [
      "Abstract",
      "1 Introduction",
      "2 Problem Definition and Analysis (2.1–2.3)",
      "3 Method (3.1–3.2)",
      "4 Experiments (4.1–4.4)",
      "5 Conclusion and Limitations",
      "References",
      "A Related Work",
      "B Pre-training Dataset Details",
      "C Real-World Experiment Setup (C.1)",
      "D Generalization Analysis in Unified World Action Models (D.1–D.2)",
      "E Algorithm",
      "F Discussion",
      "G Simulation Results",
      "H Broader Impact"
    ],
    "omissions": [
      "Text extraction does not reconstruct figure images; inspect the retained PDF for figures and equation/table layout.",
      "Separate supplemental material availability has not been fully verified.",
      "Identity: the inspected title page identifies arXiv:2606.21088v1 [cs.RO], 19 June 2026. The title and all 16 authors agree with the catalog after normalizing name order and typography. No different revision or edition was supplied or compared.",
      "All seven supplied text chunks were read individually, covering all 20 PDF pages and appendices. Extraction does not reconstruct figures; the retained PDF was therefore visually inspected separately. Reference-only pages 11–13 were read as text, without a page-image pass.",
      "Separate supplemental material availability has not been fully verified; no separate supplements were supplied.",
      "No code, external links or datasets were inspected, and no experiments were reproduced."
    ],
    "identityVerified": true,
    "figuresReviewed": [
      "Figure 1 (p. 1)",
      "Figure 2 (p. 5)",
      "Figure 3 (p. 9)",
      "Figure 4 (p. 9)",
      "Figure 5 (p. 15)",
      "Figure 6 (p. 15)",
      "Figure 7 (p. 16)",
      "Figure 8 (p. 19)",
      "Figure 9 (p. 20)"
    ],
    "tablesReviewed": [
      "Table 1 (p. 7)",
      "Table 2 (p. 8)",
      "Table 3 (p. 10)",
      "Table 4 (p. 14)",
      "Table 5 (p. 16)",
      "Table 6 (p. 17)",
      "Table 7 (p. 18)"
    ],
    "appendix": "reviewed"
  },
  "synopsis": "MV-WAM couples video, action and value generation through asymmetric shared attention. It trains video on velocity targets and actions on clean endpoints, then uses predicted progress to trigger rollback. Its strongest evidence is improved RoboTwin Random success; geometric necessity and reliable physical rollback remain less established (e-architecture, e-objectives, e-value, e-simulation, e-theory).",
  "readingTimeMinutes": 9,
  "problem": {
    "text": "Video priors improve clean-scene manipulation more reliably than action robustness under visual shifts. The authors attribute this imbalance to heterogeneous visual and action geometry, and seek to transfer action-free video experience into executable, language-conditioned action chunks.",
    "kind": "author-claim",
    "evidenceIds": [
      "e-problem"
    ]
  },
  "contributions": [
    {
      "text": "A layerwise Mixture-of-Transformers joins distinct Video and Action-Value Experts through shared attention with directional modality access.",
      "kind": "source",
      "evidenceIds": [
        "e-architecture"
      ]
    },
    {
      "text": "Separate velocity and clean-endpoint losses, plus Monte Carlo value supervision and inference-time rollback, address optimization and execution respectively.",
      "kind": "source",
      "evidenceIds": [
        "e-objectives",
        "e-value"
      ]
    },
    {
      "text": "The loss-target ablation supports the chosen parameterization. It does not establish that manifold curvature is the unique causal explanation for improved robustness.",
      "kind": "analysis",
      "evidenceIds": [
        "e-ablations",
        "e-geometry",
        "e-theory"
      ]
    }
  ],
  "method": {
    "inputs": [
      "Natural-language instruction",
      "Visual observation history and three-view RGB context",
      "State tokens and noisy video, action and value tokens"
    ],
    "outputs": [
      "Predicted future video latents/frames",
      "Robot action chunks",
      "Predicted task-progress value"
    ],
    "steps": [
      {
        "name": "Encode observations and instructions",
        "detail": "WoW-1.3B initializes the Video Expert; a spatiotemporal VAE supplies visual tokens. umT5 conditions both experts. The Action-Value Expert alternates language cross-attention in odd layers and SigLIP2 visual conditioning in even layers. Figure 2 marks the VAE, umT5 and SigLIP2 frozen.",
        "evidenceIds": [
          "e-architecture"
        ]
      },
      {
        "name": "Align and route modalities",
        "detail": "Both experts have 30 blocks. Action-side hidden width 768 projects to video width 1536 inside shared attention; its RoPE scale is one quarter of the video's. Video queries read video only; action/state queries read video and action context; value queries read the combined context.",
        "evidenceIds": [
          "e-architecture",
          "e-training"
        ]
      },
      {
        "name": "Match prediction targets",
        "detail": "Video predicts the flow velocity, while actions directly regress clean endpoints. Appendix F removes the endpoint loss's velocity-space 1/t² weighting to avoid action-loss domination near the data endpoint. This changes supervision, while endpoint-induced velocity remains part of sampling.",
        "evidenceIds": [
          "e-objectives",
          "e-sampler"
        ]
      }
    ],
    "training": [
      {
        "text": "The 1.9B parameter count excludes umT5 and SigLIP2. Video pretraining uses 20,000 steps, batch 1,024, AdamW, learning rate 10⁻⁴, weight decay 10⁻² and 240 × 320 video. Joint fine-tuning uses 15,000 steps, batch 512, learning rate 10⁻⁴ and action chunks of 32; the rate stays constant for 20% of steps, then decays linearly.",
        "kind": "source",
        "evidenceIds": [
          "e-training"
        ]
      },
      {
        "text": "The general pretraining corpus totals approximately 7,500 hours: EgoDex, Agibot, RoboMind, RoboCoin, Open X-Embodiment and 200 hours of private data. RoboTwin additionally specifies video pretraining from 50 Clean plus 500 Random demonstrations per task, followed by Clean-only paired action supervision.",
        "kind": "source",
        "evidenceIds": [
          "e-data",
          "e-protocol"
        ]
      },
      {
        "text": "Value tokens regress discounted trajectory returns with γ = 0.99. The paper does not specify a separate reinforcement-learning policy-improvement objective or fully detail reward construction and value-loss normalization.",
        "kind": "analysis",
        "evidenceIds": [
          "e-value",
          "e-objectives",
          "e-training"
        ]
      }
    ],
    "inference": [
      {
        "text": "Joint denoising defaults to five steps. Three steps attain 81.2%/54.2% Clean/Random versus 84.0%/55.7% at five. Reported throughput is 17.9 actions/second on one A800; this is not a measured rollback-inclusive deployment latency.",
        "kind": "source",
        "evidenceIds": [
          "e-ablations",
          "e-training"
        ]
      },
      {
        "text": "After executing action chunks, observations close the control loop. A rolling state-action-value buffer tracks peak progress. A value drop beyond δ triggers restoration of the peak checkpoint and stochastic resampling; default δ is 0.20. How a changed physical scene is restored is unspecified.",
        "kind": "source",
        "evidenceIds": [
          "e-control",
          "e-value",
          "e-ablations",
          "e-hardware"
        ]
      }
    ],
    "equations": [
      {
        "expression": "\\mathcal{L}_v=\\mathbb{E}_{\\tau,z_0,z_1}\\left\\|\\pi^v_\\theta(z_\\tau,\\tau,c)-(z_1-z_0)\\right\\|_2^2,\\qquad \\mathcal{L}_a=\\mathbb{E}_{\\tau,a_0,a_1}\\left\\|\\pi^a_\\theta(a_\\tau,\\tau,c)-a_0\\right\\|_2^2",
        "explanation": "Eqs. (2)–(3): z₀ and a₀ are clean video/action targets, z₁ and a₁ are noise, and τ indexes the noisy interpolation. The two π networks are the experts; c denotes conditioning here. The total loss is λᵥLᵥ + λₐLₐ with both weights one. The paper also reuses c for value.",
        "evidenceIds": [
          "e-objectives",
          "e-control"
        ]
      },
      {
        "expression": "\\hat c(s_t,a_t)=\\sum_{i=0}^{H-t}\\gamma^i r(s_{t+i},a_{t+i}),\\qquad \\hat c_t<c_{\\mathrm{peak}}-\\delta",
        "explanation": "Eq. (4) supervises value using rewards r through trajectory horizon H, at state sₜ and action aₜ. The inequality is the rollback trigger; c_peak is the largest earlier predicted value and δ the tolerated drop.",
        "evidenceIds": [
          "e-value"
        ]
      }
    ]
  },
  "results": [
    {
      "task": "RoboTwin 2.0: 50-task Clean/Random manipulation",
      "setting": "Aloha AgileX; 100 rollouts per task per condition. WAMs receive Random video pretraining but only Clean action supervision; VLA baselines use 50 Clean demonstrations per task.",
      "metric": "Mean task success rate (%)",
      "value": "84.0 Clean; 55.7 Random",
      "comparison": "HALO: 80.5/26.4; BagelVLA: 75.3/20.5.",